
T:  Bus=01 Lev=00 Prnt=00 Port=00 Cnt=00 Dev#=  1 Spd=480 MxCh= 4
D:  Ver= 2.00 Cls=09(hub  ) Sub=00 Prot=01 MxPS=64 #Cfgs=  1
P:  Vendor=1d6b ProdID=0002 Rev=03.19
S:  Manufacturer=Linux 3.19.0-32-generic xhci-hcd
S:  Product=xHCI Host Controller
S:  SerialNumber=0000:00:14.0
C:  #Ifs= 1 Cfg#= 1 Atr=e0 MxPwr=0mA
I:  If#= 0 Alt= 0 #EPs= 1 Cls=09(hub  ) Sub=00 Prot=00 Driver=hub

T:  Bus=01 Lev=01 Prnt=01 Port=00 Cnt=01 Dev#= 11 Spd=12  MxCh= 0
D:  Ver= 2.00 Cls=00(>ifc ) Sub=00 Prot=00 MxPS= 8 #Cfgs=  1
P:  Vendor=0403 ProdID=6001 Rev=06.00
S:  Manufacturer=FTDI
S:  Product=TTL232R-3V3
S:  SerialNumber=FTG710W6
C:  #Ifs= 1 Cfg#= 1 Atr=80 MxPwr=90mA
I:  If#= 0 Alt= 0 #EPs= 2 Cls=ff(vend.) Sub=ff Prot=ff Driver=ftdi_sio

T:  Bus=01 Lev=01 Prnt=01 Port=02 Cnt=02 Dev#=  2 Spd=1.5 MxCh= 0
D:  Ver= 1.10 Cls=00(>ifc ) Sub=00 Prot=00 MxPS= 8 #Cfgs=  1
P:  Vendor=0c45 ProdID=0520 Rev=00.01
S:  Manufacturer=SONiX
S:  Product=USB Device
C:  #Ifs= 2 Cfg#= 1 Atr=a0 MxPwr=100mA
I:  If#= 0 Alt= 0 #EPs= 1 Cls=03(HID  ) Sub=01 Prot=01 Driver=usbhid
I:  If#= 1 Alt= 0 #EPs= 1 Cls=03(HID  ) Sub=01 Prot=02 Driver=usbhid

T:  Bus=01 Lev=01 Prnt=01 Port=03 Cnt=03 Dev#= 12 Spd=1.5 MxCh= 0
D:  Ver= 1.10 Cls=00(>ifc ) Sub=00 Prot=00 MxPS= 8 #Cfgs=  1
P:  Vendor=05ac ProdID=020b Rev=03.01
S:  Manufacturer=WebKey
S:  Product=WebKey
C:  #Ifs= 1 Cfg#= 1 Atr=80 MxPwr=32mA
I:  If#= 0 Alt= 0 #EPs= 1 Cls=03(HID  ) Sub=01 Prot=01 Driver=usbhid

T:  Bus=02 Lev=00 Prnt=00 Port=00 Cnt=00 Dev#=  1 Spd=5000 MxCh= 4
D:  Ver= 3.00 Cls=09(hub  ) Sub=00 Prot=03 MxPS= 9 #Cfgs=  1
P:  Vendor=1d6b ProdID=0003 Rev=03.19
S:  Manufacturer=Linux 3.19.0-32-generic xhci-hcd
S:  Product=xHCI Host Controller
S:  SerialNumber=0000:00:14.0
C:  #Ifs= 1 Cfg#= 1 Atr=e0 MxPwr=0mA
I:  If#= 0 Alt= 0 #EPs= 1 Cls=09(hub  ) Sub=00 Prot=00 Driver=hub

T:  Bus=03 Lev=00 Prnt=00 Port=00 Cnt=00 Dev#=  1 Spd=480 MxCh= 2
D:  Ver= 2.00 Cls=09(hub  ) Sub=00 Prot=00 MxPS=64 #Cfgs=  1
P:  Vendor=1d6b ProdID=0002 Rev=03.19
S:  Manufacturer=Linux 3.19.0-32-generic ehci_hcd
S:  Product=EHCI Host Controller
S:  SerialNumber=0000:00:1a.0
C:  #Ifs= 1 Cfg#= 1 Atr=e0 MxPwr=0mA
I:  If#= 0 Alt= 0 #EPs= 1 Cls=09(hub  ) Sub=00 Prot=00 Driver=hub

T:  Bus=03 Lev=01 Prnt=01 Port=00 Cnt=01 Dev#=  2 Spd=480 MxCh= 6
D:  Ver= 2.00 Cls=09(hub  ) Sub=00 Prot=01 MxPS=64 #Cfgs=  1
P:  Vendor=8087 ProdID=0024 Rev=00.00
C:  #Ifs= 1 Cfg#= 1 Atr=e0 MxPwr=0mA
I:  If#= 0 Alt= 0 #EPs= 1 Cls=09(hub  ) Sub=00 Prot=00 Driver=hub

T:  Bus=03 Lev=02 Prnt=02 Port=02 Cnt=01 Dev#=  3 Spd=480 MxCh= 0
D:  Ver= 2.00 Cls=ff(vend.) Sub=ff Prot=ff MxPS=64 #Cfgs=  1
P:  Vendor=0bda ProdID=0129 Rev=39.60
S:  Manufacturer=Generic
S:  Product=USB2.0-CRW
S:  SerialNumber=20100201396000000
C:  #Ifs= 1 Cfg#= 1 Atr=a0 MxPwr=500mA
I:  If#= 0 Alt= 0 #EPs= 3 Cls=ff(vend.) Sub=06 Prot=50 Driver=rtsx_usb

T:  Bus=03 Lev=02 Prnt=02 Port=04 Cnt=02 Dev#=  4 Spd=480 MxCh= 0
D:  Ver= 2.00 Cls=ef(misc ) Sub=02 Prot=01 MxPS=64 #Cfgs=  1
P:  Vendor=0c45 ProdID=644a Rev=28.06
S:  Manufacturer=CN00YCD6724872AT1524A02
S:  Product=Laptop_Integrated_Webcam_HD
C:  #Ifs= 2 Cfg#= 1 Atr=80 MxPwr=500mA
I:  If#= 0 Alt= 0 #EPs= 1 Cls=0e(video) Sub=01 Prot=00 Driver=uvcvideo
I:  If#= 1 Alt= 0 #EPs= 0 Cls=0e(video) Sub=02 Prot=00 Driver=uvcvideo

T:  Bus=04 Lev=00 Prnt=00 Port=00 Cnt=00 Dev#=  1 Spd=480 MxCh= 2
D:  Ver= 2.00 Cls=09(hub  ) Sub=00 Prot=00 MxPS=64 #Cfgs=  1
P:  Vendor=1d6b ProdID=0002 Rev=03.19
S:  Manufacturer=Linux 3.19.0-32-generic ehci_hcd
S:  Product=EHCI Host Controller
S:  SerialNumber=0000:00:1d.0
C:  #Ifs= 1 Cfg#= 1 Atr=e0 MxPwr=0mA
I:  If#= 0 Alt= 0 #EPs= 1 Cls=09(hub  ) Sub=00 Prot=00 Driver=hub

T:  Bus=04 Lev=01 Prnt=01 Port=00 Cnt=01 Dev#=  2 Spd=480 MxCh= 8
D:  Ver= 2.00 Cls=09(hub  ) Sub=00 Prot=01 MxPS=64 #Cfgs=  1
P:  Vendor=8087 ProdID=0024 Rev=00.00
C:  #Ifs= 1 Cfg#= 1 Atr=e0 MxPwr=0mA
I:  If#= 0 Alt= 0 #EPs= 1 Cls=09(hub  ) Sub=00 Prot=00 Driver=hub

T:  Bus=04 Lev=02 Prnt=02 Port=04 Cnt=01 Dev#=  3 Spd=12  MxCh= 0
D:  Ver= 2.00 Cls=e0(wlcon) Sub=01 Prot=01 MxPS=64 #Cfgs=  1
P:  Vendor=8087 ProdID=07da Rev=78.69
C:  #Ifs= 2 Cfg#= 1 Atr=e0 MxPwr=0mA
I:  If#= 0 Alt= 0 #EPs= 3 Cls=e0(wlcon) Sub=01 Prot=01 Driver=btusb
I:  If#= 1 Alt= 0 #EPs= 2 Cls=e0(wlcon) Sub=01 Prot=01 Driver=btusb
